{
  "verse_id": "1.16",
  "mūla": {
    "devanāgarī": "अनन्त-विजयं राजा कुन्ती-पुत्रो युधिष्ठिरः | नकुलः सहदेवश् च सुघोष-मणिपुष्पकौ",
    "iast": "ananta-vijayaṃ rājā kuntī-putro yudhiṣṭhiraḥ | nakulaḥ sahadevaś ca sughoṣa-maṇipuṣpakau",
    "chapter_position": "Chapter 1 (Arjuna-Viṣāda-Yoga (The Yoga of Arjuna's Despondency)), verse 16",
    "speaker": "Arjuna",
    "addressed_to": "Krishna"
  },
  "word_by_word": [
    {
      "surface_form": "an",
      "lemma": "añji",
      "grammar": "nominative singular masculine noun",
      "senses_attested_in_panel": [],
      "theme_lists": []
    },
    {
      "surface_form": "anta",
      "lemma": "anti",
      "grammar": "vocative singular masculine noun",
      "senses_attested_in_panel": [],
      "theme_lists": []
    },
    {
      "surface_form": "vijayam",
      "lemma": "viji",
      "grammar": "accusative singular masculine noun",
      "senses_attested_in_panel": [],
      "theme_lists": []
    },
    {
      "surface_form": "rājā",
      "lemma": "rāj",
      "grammar": "instrumental singular masculine noun",
      "senses_attested_in_panel": [
        {
          "sense": "युधि चायमेव जयभागित्वेन स्थिरो नत्वेतद्विपक्षाः स्थिरा भविष्यन्तीति युधिष्ठिरपदेन सूचितम्",
          "school": "advaita-bhakti",
          "weight": 0.8,
          "witnesses": [
            "madhusudan"
          ]
        }
      ],
      "theme_lists": []
    },
    {
      "surface_form": "kuntī",
      "lemma": "kunti",
      "grammar": "nominative dual masculine noun",
      "senses_attested_in_panel": [],
      "theme_lists": []
    },
    {
      "surface_form": "yudhiṣṭhiras",
      "lemma": "yudhiṣṭhira",
      "grammar": "nominative singular masculine noun",
      "senses_attested_in_panel": [],
      "theme_lists": []
    },
    {
      "surface_form": "nakulas",
      "lemma": "nakula",
      "grammar": "nominative singular masculine noun",
      "senses_attested_in_panel": [],
      "theme_lists": []
    },
    {
      "surface_form": "sahadevas",
      "lemma": "sahadeva",
      "grammar": "nominative singular masculine noun",
      "senses_attested_in_panel": [],
      "theme_lists": []
    },
    {
      "surface_form": "ca",
      "lemma": "ca",
      "grammar": "vocative singular masculine noun",
      "senses_attested_in_panel": [],
      "theme_lists": []
    },
    {
      "surface_form": "sughoṣa",
      "lemma": "sughoṣa",
      "grammar": "vocative singular neuter noun",
      "senses_attested_in_panel": [],
      "theme_lists": []
    },
    {
      "surface_form": "maṇipuṣpakau",
      "lemma": "maṇipuṣpaka",
      "grammar": "nominative dual masculine noun",
      "senses_attested_in_panel": [],
      "theme_lists": []
    }
  ],
  "intertextual_panel": [
    {
      "verse": "11.19",
      "type": "long-distance thematic echo",
      "score": 0.8945,
      "feature_breakdown": {
        "cosine": 0.8512,
        "theme_graph": 1.0,
        "vocative": 0.0,
        "substring": 0.0662,
        "lemma_overlap": 6.0226,
        "stem_prefix": 2.0
      }
    },
    {
      "verse": "13.9",
      "type": "semantic neighbor",
      "score": 0.8905,
      "feature_breakdown": {
        "cosine": 0.8705,
        "theme_graph": 0.0,
        "vocative": 0.0,
        "substring": 0.0,
        "lemma_overlap": 4.0077,
        "stem_prefix": 2.0
      }
    },
    {
      "verse": "11.40",
      "type": "long-distance thematic echo",
      "score": 0.8817,
      "feature_breakdown": {
        "cosine": 0.8384,
        "theme_graph": 1.0,
        "vocative": 0.0,
        "substring": 0.0662,
        "lemma_overlap": 6.0226,
        "stem_prefix": 2.0
      }
    },
    {
      "verse": "11.38",
      "type": "long-distance thematic echo",
      "score": 0.8785,
      "feature_breakdown": {
        "cosine": 0.8272,
        "theme_graph": 1.0,
        "vocative": 0.0,
        "substring": 0.0568,
        "lemma_overlap": 7.0917,
        "stem_prefix": 3.0
      }
    },
    {
      "verse": "1.32",
      "type": "shared-vocabulary echo",
      "score": 0.875,
      "feature_breakdown": {
        "cosine": 0.845,
        "theme_graph": 0.0,
        "vocative": 0.0,
        "substring": 0.0,
        "lemma_overlap": 9.0624,
        "stem_prefix": 3.0
      }
    },
    {
      "verse": "1.4",
      "type": "semantic neighbor",
      "score": 0.8716,
      "feature_breakdown": {
        "cosine": 0.8516,
        "theme_graph": 0.0,
        "vocative": 0.0,
        "substring": 0.0,
        "lemma_overlap": 1.069,
        "stem_prefix": 2.0
      }
    },
    {
      "verse": "2.41",
      "type": "cross-chapter thematic parallel",
      "score": 0.8711,
      "feature_breakdown": {
        "cosine": 0.8411,
        "theme_graph": 1.0,
        "vocative": 0.0,
        "substring": 0.0,
        "lemma_overlap": 1.069,
        "stem_prefix": 2.0
      }
    },
    {
      "verse": "11.11",
      "type": "long-distance thematic echo",
      "score": 0.87,
      "feature_breakdown": {
        "cosine": 0.85,
        "theme_graph": 1.0,
        "vocative": 0.0,
        "substring": 0.0,
        "lemma_overlap": 0.0,
        "stem_prefix": 1.0
      }
    }
  ],
  "doctrinal_projections": {
    "advaita": {
      "reading_summary": "(reading summary extraction pending; ENABLE_READING_SUMMARIES=true to generate)",
      "key_cross_references": [],
      "witness_passages": [
        "shankara_1.16",
        "anandgiri_1.16"
      ],
      "score": 0.5
    },
    "viśiṣṭādvaita": {
      "reading_summary": "(reading summary extraction pending; ENABLE_READING_SUMMARIES=true to generate)",
      "key_cross_references": [],
      "witness_passages": [
        "ramanuja_1.16",
        "vedantadeshika_1.16"
      ],
      "score": 0.5
    },
    "śuddhādvaita": {
      "reading_summary": "(reading summary extraction pending; ENABLE_READING_SUMMARIES=true to generate)",
      "key_cross_references": [],
      "witness_passages": [
        "vallabha_1.16"
      ],
      "score": 0.5
    },
    "bhakti": {
      "reading_summary": "(reading summary extraction pending; ENABLE_READING_SUMMARIES=true to generate)",
      "key_cross_references": [],
      "witness_passages": [
        "sridhara_1.16"
      ],
      "score": 0.5
    },
    "advaita-bhakti": {
      "reading_summary": "(reading summary extraction pending; ENABLE_READING_SUMMARIES=true to generate)",
      "key_cross_references": [],
      "witness_passages": [
        "madhusudan_1.16"
      ],
      "score": 0.5
    }
  },
  "prosodic_information": {
    "meter": "anuṣṭubh",
    "meter_shift_from_previous": false,
    "meter_shift_to_next": false,
    "pragmatic_context": {
      "vocative": "",
      "preceding_question": "",
      "following_response": ""
    }
  },
  "theme_list_memberships": [
    {
      "list": "अनन्त",
      "role": "supporting",
      "other_verses_in_list": [
        "2.41",
        "10.29",
        "10.40",
        "11.11",
        "11.19",
        "11.37",
        "11.38",
        "11.40",
        "11.47",
        "12.12"
      ]
    }
  ],
  "audit_trail": {
    "substrate_version": "v2.6-frozen",
    "fitted_weights": {
      "a": 1.0,
      "b": 0.01,
      "e_v": 0.005,
      "z": 0.2,
      "h": 0.0,
      "th": 0.01
    },
    "corpus_provenance": {
      "mūla": "Belvalkar critical edition (BORI 1947), via Ambuda multi-witness",
      "panel_witnesses": [
        "bg-mula",
        "bg-shankara",
        "bg-ramanuja",
        "bg-madhva",
        "bg-vedantadeshika",
        "bg-vallabha",
        "bg-jayatirtha",
        "bg-anandgiri",
        "bg-sridhara",
        "bg-madhusudan"
      ]
    },
    "extraction_date": "2026-04-21",
    "score_methodology_documented_at": "Paper 1, Section II.B"
  }
}