{
  "verse_id": "11.48",
  "mūla": {
    "devanāgarī": "न वेद यज्ञाध्ययनैर् न दानैर् न च क्रियाभिर् न तपोभिर् उग्रैः | एवं-रूपः शक्य अहं नृ-लोके द्रष्टुं त्वद्-अन्येन कुरु-प्रवीर",
    "iast": "na veda yajñādhyayanair na dānair na ca kriyābhir na tapobhir ugraiḥ | evaṃ-rūpaḥ śakya ahaṃ nṛ-loke draṣṭuṃ tvad-anyena kuru-pravīra",
    "chapter_position": "Chapter 11 (Viśvarūpa-Darśana-Yoga (The Yoga of the Vision of the Universal Form)), verse 48",
    "speaker": "Krishna",
    "addressed_to": "Arjuna"
  },
  "word_by_word": [],
  "intertextual_panel": [
    {
      "verse": "11.53",
      "type": "near-cluster echo",
      "score": 0.8606,
      "feature_breakdown": {
        "cosine": 0.8606,
        "theme_graph": 0.0,
        "vocative": 0.0,
        "substring": 0.0,
        "lemma_overlap": 0.0,
        "stem_prefix": 0.0
      }
    },
    {
      "verse": "3.22",
      "type": "long-distance thematic echo",
      "score": 0.8525,
      "feature_breakdown": {
        "cosine": 0.8425,
        "theme_graph": 1.0,
        "vocative": 0.0,
        "substring": 0.0,
        "lemma_overlap": 0.0,
        "stem_prefix": 0.0
      }
    },
    {
      "verse": "11.8",
      "type": "semantic neighbor",
      "score": 0.8505,
      "feature_breakdown": {
        "cosine": 0.8505,
        "theme_graph": 0.0,
        "vocative": 0.0,
        "substring": 0.0,
        "lemma_overlap": 0.0,
        "stem_prefix": 0.0
      }
    },
    {
      "verse": "14.22",
      "type": "semantic neighbor",
      "score": 0.8503,
      "feature_breakdown": {
        "cosine": 0.8503,
        "theme_graph": 0.0,
        "vocative": 0.0,
        "substring": 0.0,
        "lemma_overlap": 0.0,
        "stem_prefix": 0.0
      }
    },
    {
      "verse": "11.24",
      "type": "thematic-similarity",
      "score": 0.8471,
      "feature_breakdown": {
        "cosine": 0.8471,
        "theme_graph": 0.0,
        "vocative": 0.0,
        "substring": 0.0,
        "lemma_overlap": 0.0,
        "stem_prefix": 0.0
      }
    },
    {
      "verse": "11.54",
      "type": "thematic-similarity",
      "score": 0.8465,
      "feature_breakdown": {
        "cosine": 0.8465,
        "theme_graph": 0.0,
        "vocative": 0.0,
        "substring": 0.0,
        "lemma_overlap": 0.0,
        "stem_prefix": 0.0
      }
    },
    {
      "verse": "3.24",
      "type": "thematic-similarity",
      "score": 0.8447,
      "feature_breakdown": {
        "cosine": 0.8447,
        "theme_graph": 0.0,
        "vocative": 0.0,
        "substring": 0.0,
        "lemma_overlap": 0.0,
        "stem_prefix": 0.0
      }
    },
    {
      "verse": "9.5",
      "type": "thematic-similarity",
      "score": 0.8446,
      "feature_breakdown": {
        "cosine": 0.8446,
        "theme_graph": 0.0,
        "vocative": 0.0,
        "substring": 0.0,
        "lemma_overlap": 0.0,
        "stem_prefix": 0.0
      }
    }
  ],
  "doctrinal_projections": {
    "advaita": {
      "reading_summary": "(reading summary extraction pending; ENABLE_READING_SUMMARIES=true to generate)",
      "key_cross_references": [],
      "witness_passages": [
        "shankara_11.48",
        "anandgiri_11.48"
      ],
      "score": 0.5
    },
    "viśiṣṭādvaita": {
      "reading_summary": "(reading summary extraction pending; ENABLE_READING_SUMMARIES=true to generate)",
      "key_cross_references": [],
      "witness_passages": [
        "ramanuja_11.48",
        "vedantadeshika_11.48"
      ],
      "score": 0.5
    },
    "dvaita": {
      "reading_summary": "(reading summary extraction pending; ENABLE_READING_SUMMARIES=true to generate)",
      "key_cross_references": [],
      "witness_passages": [
        "madhva_11.48",
        "jayatirtha_11.48"
      ],
      "score": 0.5
    },
    "śuddhādvaita": {
      "reading_summary": "(reading summary extraction pending; ENABLE_READING_SUMMARIES=true to generate)",
      "key_cross_references": [],
      "witness_passages": [
        "vallabha_11.48"
      ],
      "score": 0.5
    },
    "bhakti": {
      "reading_summary": "(reading summary extraction pending; ENABLE_READING_SUMMARIES=true to generate)",
      "key_cross_references": [],
      "witness_passages": [
        "sridhara_11.48"
      ],
      "score": 0.5
    },
    "advaita-bhakti": {
      "reading_summary": "(reading summary extraction pending; ENABLE_READING_SUMMARIES=true to generate)",
      "key_cross_references": [],
      "witness_passages": [
        "madhusudan_11.48"
      ],
      "score": 0.5
    }
  },
  "prosodic_information": {
    "meter": "triṣṭubh",
    "meter_shift_from_previous": false,
    "meter_shift_to_next": false,
    "pragmatic_context": {
      "vocative": "",
      "preceding_question": "",
      "following_response": ""
    }
  },
  "theme_list_memberships": [
    {
      "list": "क्रिया",
      "role": "supporting",
      "other_verses_in_list": [
        "1.42",
        "2.43",
        "3.22",
        "3.37",
        "5.8",
        "5.9",
        "9.26",
        "17.24",
        "17.25",
        "18.33"
      ]
    }
  ],
  "audit_trail": {
    "substrate_version": "v2.6-frozen",
    "fitted_weights": {
      "a": 1.0,
      "b": 0.01,
      "e_v": 0.005,
      "z": 0.2,
      "h": 0.0,
      "th": 0.01
    },
    "corpus_provenance": {
      "mūla": "Belvalkar critical edition (BORI 1947), via Ambuda multi-witness",
      "panel_witnesses": [
        "bg-mula",
        "bg-shankara",
        "bg-ramanuja",
        "bg-madhva",
        "bg-vedantadeshika",
        "bg-vallabha",
        "bg-jayatirtha",
        "bg-anandgiri",
        "bg-sridhara",
        "bg-madhusudan"
      ]
    },
    "extraction_date": "2026-04-21",
    "score_methodology_documented_at": "Paper 1, Section II.B"
  }
}