{
  "verse_id": "1.46",
  "mūla": {
    "devanāgarī": "यदि माम् अप्रतीकारम् अशस्त्रं शस्त्र-पाणयः | धार्तराष्ट्रा रणे हन्युस् तन् मे क्षेमतरं भवेत्",
    "iast": "yadi mām apratīkāram aśastraṃ śastra-pāṇayaḥ | dhārtarāṣṭrā raṇe hanyus tan me kṣemataraṃ bhavet",
    "chapter_position": "Chapter 1 (Arjuna-Viṣāda-Yoga (The Yoga of Arjuna's Despondency)), verse 46",
    "speaker": "Arjuna",
    "addressed_to": "Krishna"
  },
  "word_by_word": [
    {
      "surface_form": "yadi",
      "lemma": "yadi",
      "grammar": "nominative singular masculine noun",
      "senses_attested_in_panel": [],
      "theme_lists": []
    },
    {
      "surface_form": "mām",
      "lemma": "mā",
      "grammar": "Vibhakti.Sasthi plural neuter noun",
      "senses_attested_in_panel": [],
      "theme_lists": []
    },
    {
      "surface_form": "aprati",
      "lemma": "aprati",
      "grammar": "vocative singular neuter noun",
      "senses_attested_in_panel": [],
      "theme_lists": []
    },
    {
      "surface_form": "īkāram",
      "lemma": "īkāra",
      "grammar": "accusative singular masculine noun",
      "senses_attested_in_panel": [],
      "theme_lists": []
    },
    {
      "surface_form": "aśastram",
      "lemma": "aśastra",
      "grammar": "accusative singular masculine noun",
      "senses_attested_in_panel": [],
      "theme_lists": []
    },
    {
      "surface_form": "śastra",
      "lemma": "śastra",
      "grammar": "vocative singular neuter noun",
      "senses_attested_in_panel": [],
      "theme_lists": []
    },
    {
      "surface_form": "dhā",
      "lemma": "dhā",
      "grammar": "vocative singular neuter noun",
      "senses_attested_in_panel": [],
      "theme_lists": []
    },
    {
      "surface_form": "artar",
      "lemma": "ṛ",
      "grammar": "vocative singular masculine noun",
      "senses_attested_in_panel": [],
      "theme_lists": []
    },
    {
      "surface_form": "a",
      "lemma": "a",
      "grammar": "vocative singular masculine noun",
      "senses_attested_in_panel": [],
      "theme_lists": []
    },
    {
      "surface_form": "aṣṭrā",
      "lemma": "aś",
      "grammar": "instrumental singular masculine noun",
      "senses_attested_in_panel": [],
      "theme_lists": []
    },
    {
      "surface_form": "raṇa",
      "lemma": "raṇ",
      "grammar": "2nd person singular imperative active verb",
      "senses_attested_in_panel": [],
      "theme_lists": []
    },
    {
      "surface_form": "ī",
      "lemma": "i",
      "grammar": "nominative dual masculine noun",
      "senses_attested_in_panel": [],
      "theme_lists": []
    },
    {
      "surface_form": "hanyus",
      "lemma": "han",
      "grammar": "3rd person plural optative active verb",
      "senses_attested_in_panel": [],
      "theme_lists": []
    },
    {
      "surface_form": "tan",
      "lemma": "tan",
      "grammar": "vocative singular masculine noun",
      "senses_attested_in_panel": [],
      "theme_lists": []
    },
    {
      "surface_form": "me",
      "lemma": "mā",
      "grammar": "locative singular neuter noun",
      "senses_attested_in_panel": [],
      "theme_lists": []
    },
    {
      "surface_form": "kṣā",
      "lemma": "kṣā",
      "grammar": "nominative singular feminine noun",
      "senses_attested_in_panel": [],
      "theme_lists": []
    },
    {
      "surface_form": "im",
      "lemma": "i",
      "grammar": "accusative singular masculine noun",
      "senses_attested_in_panel": [],
      "theme_lists": []
    },
    {
      "surface_form": "ataram",
      "lemma": "tṝ",
      "grammar": "1st person singular imperfect active verb",
      "senses_attested_in_panel": [],
      "theme_lists": []
    },
    {
      "surface_form": "bhavet",
      "lemma": "bhū",
      "grammar": "3rd person singular optative active verb",
      "senses_attested_in_panel": [],
      "theme_lists": []
    }
  ],
  "intertextual_panel": [
    {
      "verse": "1.20",
      "type": "lemma-family resonance",
      "score": 0.8977,
      "feature_breakdown": {
        "cosine": 0.8377,
        "theme_graph": 0.0,
        "vocative": 0.0,
        "substring": 0.0,
        "lemma_overlap": 15.9622,
        "stem_prefix": 6.0
      }
    },
    {
      "verse": "1.23",
      "type": "lemma-family resonance",
      "score": 0.8813,
      "feature_breakdown": {
        "cosine": 0.8413,
        "theme_graph": 0.0,
        "vocative": 0.0,
        "substring": 0.0,
        "lemma_overlap": 9.6653,
        "stem_prefix": 4.0
      }
    },
    {
      "verse": "1.1",
      "type": "lemma-family resonance",
      "score": 0.8772,
      "feature_breakdown": {
        "cosine": 0.8172,
        "theme_graph": 0.0,
        "vocative": 0.0,
        "substring": 0.0,
        "lemma_overlap": 10.8823,
        "stem_prefix": 6.0
      }
    },
    {
      "verse": "15.12",
      "type": "shared-vocabulary echo",
      "score": 0.876,
      "feature_breakdown": {
        "cosine": 0.826,
        "theme_graph": 0.0,
        "vocative": 0.0,
        "substring": 0.0,
        "lemma_overlap": 7.9068,
        "stem_prefix": 5.0
      }
    },
    {
      "verse": "4.7",
      "type": "shared-vocabulary echo",
      "score": 0.875,
      "feature_breakdown": {
        "cosine": 0.835,
        "theme_graph": 0.0,
        "vocative": 0.0,
        "substring": 0.0,
        "lemma_overlap": 6.6645,
        "stem_prefix": 4.0
      }
    },
    {
      "verse": "9.22",
      "type": "long-distance thematic echo",
      "score": 0.8723,
      "feature_breakdown": {
        "cosine": 0.8223,
        "theme_graph": 1.0,
        "vocative": 0.0,
        "substring": 0.0,
        "lemma_overlap": 8.2858,
        "stem_prefix": 4.0
      }
    },
    {
      "verse": "3.23",
      "type": "lemma-family resonance",
      "score": 0.872,
      "feature_breakdown": {
        "cosine": 0.832,
        "theme_graph": 0.0,
        "vocative": 0.0,
        "substring": 0.0,
        "lemma_overlap": 9.117,
        "stem_prefix": 4.0
      }
    },
    {
      "verse": "1.36",
      "type": "lemma-family resonance",
      "score": 0.8713,
      "feature_breakdown": {
        "cosine": 0.8113,
        "theme_graph": 0.0,
        "vocative": 0.0,
        "substring": 0.0,
        "lemma_overlap": 14.4875,
        "stem_prefix": 6.0
      }
    }
  ],
  "doctrinal_projections": {
    "advaita": {
      "reading_summary": "(reading summary extraction pending; ENABLE_READING_SUMMARIES=true to generate)",
      "key_cross_references": [],
      "witness_passages": [
        "shankara_1.46",
        "anandgiri_1.46"
      ],
      "score": 0.5
    },
    "viśiṣṭādvaita": {
      "reading_summary": "(reading summary extraction pending; ENABLE_READING_SUMMARIES=true to generate)",
      "key_cross_references": [],
      "witness_passages": [
        "ramanuja_1.46",
        "vedantadeshika_1.46"
      ],
      "score": 0.5
    },
    "dvaita": {
      "reading_summary": "(reading summary extraction pending; ENABLE_READING_SUMMARIES=true to generate)",
      "key_cross_references": [],
      "witness_passages": [
        "madhva_1.46",
        "jayatirtha_1.46"
      ],
      "score": 0.5
    },
    "śuddhādvaita": {
      "reading_summary": "(reading summary extraction pending; ENABLE_READING_SUMMARIES=true to generate)",
      "key_cross_references": [],
      "witness_passages": [
        "vallabha_1.46"
      ],
      "score": 0.5
    },
    "advaita-bhakti": {
      "reading_summary": "(reading summary extraction pending; ENABLE_READING_SUMMARIES=true to generate)",
      "key_cross_references": [],
      "witness_passages": [
        "madhusudan_1.46"
      ],
      "score": 0.5
    }
  },
  "prosodic_information": {
    "meter": "anuṣṭubh",
    "meter_shift_from_previous": false,
    "meter_shift_to_next": false,
    "pragmatic_context": {
      "vocative": "",
      "preceding_question": "",
      "following_response": ""
    }
  },
  "theme_list_memberships": [
    {
      "list": "करिष्ये वचनं तव",
      "role": "supporting",
      "other_verses_in_list": [
        "18.73"
      ]
    },
    {
      "list": "क्षेम",
      "role": "supporting",
      "other_verses_in_list": [
        "2.45",
        "9.22"
      ]
    },
    {
      "list": "न योत्स्ये",
      "role": "supporting",
      "other_verses_in_list": [
        "2.7",
        "4.42",
        "11.32"
      ]
    }
  ],
  "audit_trail": {
    "substrate_version": "v2.6-frozen",
    "fitted_weights": {
      "a": 1.0,
      "b": 0.01,
      "e_v": 0.005,
      "z": 0.2,
      "h": 0.0,
      "th": 0.01
    },
    "corpus_provenance": {
      "mūla": "Belvalkar critical edition (BORI 1947), via Ambuda multi-witness",
      "panel_witnesses": [
        "bg-mula",
        "bg-shankara",
        "bg-ramanuja",
        "bg-madhva",
        "bg-vedantadeshika",
        "bg-vallabha",
        "bg-jayatirtha",
        "bg-anandgiri",
        "bg-sridhara",
        "bg-madhusudan"
      ]
    },
    "extraction_date": "2026-04-21",
    "score_methodology_documented_at": "Paper 1, Section II.B"
  }
}